{
	"contract_version": "invalidate-git-diff-v1",
	"repository": "acme/checkout",
	"diff": {
		"files_changed": 7,
		"from_ref": "origin/main",
		"to_ref": "HEAD"
	},
	"summary": {
		"watch_matches": 4,
		"soft_invalidated": 2,
		"hard_invalidated": 1,
		"drift_detected": 1,
		"skipped": 0
	},
	"entries": [
		{
			"id": "11111111-1111-1111-1111-111111111111",
			"title": "Invoice total includes tax",
			"action": "soft_invalidate",
			"reason": "Minor changes in watched files",
			"trigger": "file"
		},
		{
			"id": "22222222-2222-2222-2222-222222222222",
			"title": "Use event sourcing for orders",
			"action": "soft_invalidate",
			"reason": "Major changes in watched files",
			"trigger": "symbol"
		},
		{
			"id": "33333333-3333-3333-3333-333333333333",
			"title": "Checkout uses idempotency keys",
			"action": "hard_invalidate",
			"reason": "Watched file deleted: src/checkout/idempotency.ts",
			"trigger": "file_deleted"
		},
		{
			"id": "44444444-4444-4444-4444-444444444444",
			"title": "Retry policy — exactly 3 attempts",
			"action": "drift_invalidate",
			"reason": "Semantic drift: retryPolicy, retryCount",
			"trigger": "drift"
		}
	]
}
